{
  "_license": {
    "classification": "machine_readable_proof_bundle",
    "copyright": "Copyright 2026 Ingolf Lohmann",
    "license": "CC-BY-NC-ND-4.0",
    "license_text_ref": "LICENSES/CC-BY-NC-ND-4.0.txt",
    "rights_holder": "Ingolf Lohmann"
  },
  "schema": "qikvrt_zenodo_machine_proof_bundle_v2",
  "policy": {
    "id": "qikvrt-zenodo-machine-proof-before-publication-v2",
    "path": "policy/zenodo-machine-proof-policy-v2.json",
    "version": "2.0.0",
    "sha256": "933d6322a1e294848c6385d1384ab0ec3862c8675ebe35ec2fc4cad3e0baec47",
    "git_blob_sha1": "e9578d30d22f845e7df684128dcd9332641c00be"
  },
  "publication_id": "qikvrt-causal-distance-lean-20261024",
  "candidate": {
    "files": [
      {
        "path": "release/causal-distance-lean-2026-10-24/QIKVRT_Kausale_Distanz_Fachartikel.pdf",
        "bytes": 149762,
        "sha256": "7e50bc80d4017b6e43c495fdc7c19a2a322e51a2cd7e2fd9edb1072cf389caf5",
        "git_blob_sha1": "a23b5e1081037d2614b9cd2219eb4f429423b549",
        "name": "QIKVRT_Kausale_Distanz_Fachartikel.pdf",
        "role": "PRIMARY"
      },
      {
        "path": "release/causal-distance-lean-2026-10-24/QIKVRT_Wie_weit_ist_eine_Wirkung_Prosa.pdf",
        "bytes": 121544,
        "sha256": "feaa7c803c0f556b8c0c52ad33b47d606399da2b6701f0a26d90be87952afd8f",
        "git_blob_sha1": "0f00df3cd8b3808716b603b50203a3dda091d897",
        "name": "QIKVRT_Wie_weit_ist_eine_Wirkung_Prosa.pdf",
        "role": "SUPPLEMENT"
      },
      {
        "path": "release/causal-distance-lean-2026-10-24/Fachartikel.md",
        "bytes": 37142,
        "sha256": "08f15d85578bee513c63e1d3f5dfabceb64ad3ee93cad74f43a51ac0f4ee92ad",
        "git_blob_sha1": "6f0c7ff7ac59376c77b6c5e448df7c53310e66b6",
        "name": "Fachartikel.md",
        "role": "SUPPLEMENT"
      },
      {
        "path": "release/causal-distance-lean-2026-10-24/Prosaartikel.txt",
        "bytes": 28752,
        "sha256": "ad6623349bfa59326677dfd2fa2774698e6678ca0822d8fe6a0d956826991191",
        "git_blob_sha1": "2895785d4f1cb737d1140587e2f7cdc6a0c7b70c",
        "name": "Prosaartikel.txt",
        "role": "SUPPLEMENT"
      },
      {
        "path": "release/causal-distance-lean-2026-10-24/QIKVRT_Prosa_Vorlesetext.txt",
        "bytes": 24863,
        "sha256": "1fbeaec8006b4180405b07c45444f3dc8010236d742a62a43fd2b556d5f50b57",
        "git_blob_sha1": "9a28b62c912ff174aa59d6848f44d315e1db0a69",
        "name": "QIKVRT_Prosa_Vorlesetext.txt",
        "role": "SUPPLEMENT"
      },
      {
        "path": "release/causal-distance-lean-2026-10-24/QIKVRT_Causal_Distance_20261024.zip",
        "bytes": 262030,
        "sha256": "d070ae7e9c15feeadedddf55b3bf77072a3b74289dad60bb3adce4aee7089f91",
        "git_blob_sha1": "87d485faf527dab24a1bc98dd28cd7ab532a764a",
        "name": "QIKVRT_Causal_Distance_20261024.zip",
        "role": "SUPPLEMENT"
      },
      {
        "path": "release/causal-distance-lean-2026-10-24/QIKVRT_Framework_Selbstvermessung_20261024.zip",
        "bytes": 201027,
        "sha256": "01d874f116d68119c3278345bc09fb72fcd1917e88dd27e51b726ef950b3e542",
        "git_blob_sha1": "9d604052aab7807bdfd394467efe2b5dc62bad65",
        "name": "QIKVRT_Framework_Selbstvermessung_20261024.zip",
        "role": "SUPPLEMENT"
      },
      {
        "path": "release/causal-distance-lean-2026-10-24/LESEPFAD_NACH_INTERESSE.md",
        "bytes": 7588,
        "sha256": "becc9ff671680db7fbe1a6f7869b7aba5df0916a0be50f339abe23ce57e43024",
        "git_blob_sha1": "9e9a2c23436f43d5866e48c1534c5dae00ce3aa3",
        "name": "LESEPFAD_NACH_INTERESSE.md",
        "role": "SUPPLEMENT"
      },
      {
        "path": "release/causal-distance-lean-2026-10-24/QIKVRT_Lean_Anschluss_20261024.zip",
        "bytes": 167096,
        "sha256": "939b7da32b31972ea596b4a1ffdb8a9c1baafe3d8eb02d99f659ac005e813636",
        "git_blob_sha1": "f5dd753352370e665d89625cb0d4e2270b407ff3",
        "name": "QIKVRT_Lean_Anschluss_20261024.zip",
        "role": "SUPPLEMENT"
      },
      {
        "path": "release/causal-distance-lean-2026-10-24/LEAN_ANBINDUNG.md",
        "bytes": 10937,
        "sha256": "210047901873f28d110f837f284f4ce3a76e76acd6c62e35bbe88884b1174dae",
        "git_blob_sha1": "3b5b918c1b1b16f9a83ca3426288df7a9de97eda",
        "name": "LEAN_ANBINDUNG.md",
        "role": "SUPPLEMENT"
      }
    ],
    "primary_document_path": "release/causal-distance-lean-2026-10-24/QIKVRT_Kausale_Distanz_Fachartikel.pdf"
  },
  "claims": [
    {
      "claim_id": "CD-001",
      "statement": "Die Vorarbeit trennt OBSERVED und ANTICIPATED und definiert eine enge operationale Protokoll-Retrokausalität.",
      "classification": "SOURCE_BOUND",
      "status": "BOUND",
      "publication_wording": "SOURCE_ATTRIBUTED",
      "scope": "Archivierter Scope von DOI 21711193.",
      "proof_refs": [],
      "evidence_refs": [],
      "source_refs": [
        "release/causal-distance-lean-2026-10-24/SOURCE_BINDINGS.json#S1"
      ]
    },
    {
      "claim_id": "CD-002",
      "statement": "Der Messgraph bindet Gegenstand, Ereignisauflösung, Relationstyp und positive ganzzahlige Kantengewichte.",
      "classification": "NORMATIVE",
      "status": "DECLARED",
      "publication_wording": "NORMATIVE_DECLARATION",
      "scope": "Definition dieses endlichen Modellobjekts.",
      "proof_refs": [],
      "evidence_refs": [],
      "source_refs": []
    },
    {
      "claim_id": "CD-003",
      "statement": "Gerichtete Distanz ist der kürzeste gewichtete Abhängigkeitspfad; die symmetrische Projektion hat einen anderen Interpretationsbereich.",
      "classification": "NORMATIVE",
      "status": "DECLARED",
      "publication_wording": "NORMATIVE_DECLARATION",
      "scope": "Definierte Messvorschrift; keine universelle Naturmetrik.",
      "proof_refs": [],
      "evidence_refs": [],
      "source_refs": []
    },
    {
      "claim_id": "CD-004",
      "statement": "Die analytische Herleitung ergibt eine erweiterte Quasimetrik und eine Metrik je schwacher Komponente der Projektion.",
      "classification": "SOURCE_BOUND",
      "status": "BOUND",
      "publication_wording": "SOURCE_ATTRIBUTED",
      "scope": "Angegebene endliche positive Graphdefinition; keine neue Lean-Ausführung.",
      "proof_refs": [],
      "evidence_refs": [
        "release/causal-distance-lean-2026-10-24/EVIDENCE_INDEX.json#MATH"
      ],
      "source_refs": [
        "release/causal-distance-lean-2026-10-24/SOURCE_BINDINGS.json#S3"
      ]
    },
    {
      "claim_id": "CD-005",
      "statement": "Vier kontrollierte Fälle unterscheiden die freigegebene Dateiänderung 2 nach 3 von drei verweigerten Änderungen.",
      "classification": "EMPIRICALLY_EVIDENCED",
      "status": "EVIDENCED",
      "publication_wording": "EMPIRICALLY_SUPPORTED",
      "scope": "Isolierter lokaler Programmlauf.",
      "proof_refs": [],
      "evidence_refs": [
        "release/causal-distance-lean-2026-10-24/EVIDENCE_INDEX.json#FOUR_CASES"
      ],
      "source_refs": []
    },
    {
      "claim_id": "CD-006",
      "statement": "Elf native Testjournalereignisse wurden über den originalen Terminal-Leser nach erneutem Öffnen bestätigt.",
      "classification": "EMPIRICALLY_EVIDENCED",
      "status": "EVIDENCED",
      "publication_wording": "EMPIRICALLY_SUPPORTED",
      "scope": "Frisches lokales Testjournal; keine produktive Mesh-Replikation.",
      "proof_refs": [],
      "evidence_refs": [
        "release/causal-distance-lean-2026-10-24/EVIDENCE_INDEX.json#JOURNAL"
      ],
      "source_refs": []
    },
    {
      "claim_id": "CD-007",
      "statement": "Die dokumentierten ursprünglichen Tests bestehen aus 16 neuen, 41 originalen EAP- und vier ausgewählten originalen Ledger-Tests.",
      "classification": "EMPIRICALLY_EVIDENCED",
      "status": "EVIDENCED",
      "publication_wording": "EMPIRICALLY_SUPPORTED",
      "scope": "61 Tests am eingefrorenen ursprünglichen Kandidaten.",
      "proof_refs": [],
      "evidence_refs": [
        "release/causal-distance-lean-2026-10-24/EVIDENCE_INDEX.json#CORE_TESTS"
      ],
      "source_refs": []
    },
    {
      "claim_id": "CD-008",
      "statement": "Alle 4096 gerichteten Graphen auf vier Knoten werden gegen eine unabhängige Floyd-Warshall-Auswertung geprüft.",
      "classification": "EMPIRICALLY_EVIDENCED",
      "status": "EVIDENCED",
      "publication_wording": "EMPIRICALLY_SUPPORTED",
      "scope": "Endliche Implementierungsprüfung; kein Ersatz des allgemeinen analytischen Arguments.",
      "proof_refs": [],
      "evidence_refs": [
        "release/causal-distance-lean-2026-10-24/EVIDENCE_INDEX.json#GRAPH_TESTS"
      ],
      "source_refs": []
    },
    {
      "claim_id": "CD-009",
      "statement": "Ereignisordnung, Provenienz und kausale Intervention sind unterschiedliche wissenschaftliche Begriffe.",
      "classification": "SOURCE_BOUND",
      "status": "BOUND",
      "publication_wording": "SOURCE_ATTRIBUTED",
      "scope": "Geltungsbereiche der benannten Primärquellen.",
      "proof_refs": [],
      "evidence_refs": [],
      "source_refs": [
        "release/causal-distance-lean-2026-10-24/SOURCE_BINDINGS.json#S4",
        "release/causal-distance-lean-2026-10-24/SOURCE_BINDINGS.json#S5",
        "release/causal-distance-lean-2026-10-24/SOURCE_BINDINGS.json#S6"
      ]
    },
    {
      "claim_id": "CD-010",
      "statement": "Physische Future-Input-Abhängigkeit ist von heutiger Zielrepräsentation und Retrodiktion zu unterscheiden.",
      "classification": "SOURCE_BOUND",
      "status": "BOUND",
      "publication_wording": "SOURCE_ATTRIBUTED",
      "scope": "Modellbegriff der benannten quantenphysikalischen Primärquelle und Vorarbeit.",
      "proof_refs": [],
      "evidence_refs": [],
      "source_refs": [
        "release/causal-distance-lean-2026-10-24/SOURCE_BINDINGS.json#S1",
        "release/causal-distance-lean-2026-10-24/SOURCE_BINDINGS.json#S7"
      ]
    },
    {